{
  "$schema": "https://ui.shadcn.com/schema/registry-item.json",
  "name": "login-01",
  "title": "Login 01",
  "description": "A simple login form.",
  "registryDependencies": [
    "button",
    "card",
    "input",
    "label",
    "field"
  ],
  "files": [
    {
      "path": "registry/react-aria-sera/blocks/login-01/page.tsx",
      "content": "import { LoginForm } from \"@/registry/react-aria-sera/blocks/login-01/components/login-form\"\n\nexport default function Page() {\n  return (\n    <div className=\"flex min-h-svh w-full items-center justify-center p-6 md:p-10\">\n      <div className=\"w-full max-w-sm\">\n        <LoginForm />\n      </div>\n    </div>\n  )\n}\n",
      "type": "registry:page",
      "target": "app/login/page.tsx"
    },
    {
      "path": "registry/react-aria-sera/blocks/login-01/components/login-form.tsx",
      "content": "import { cn } from \"@/registry/react-aria-sera/lib/utils\"\nimport { Button } from \"@/registry/react-aria-sera/ui/button\"\nimport {\n  Card,\n  CardContent,\n  CardDescription,\n  CardHeader,\n  CardTitle,\n} from \"@/registry/react-aria-sera/ui/card\"\nimport {\n  Field,\n  FieldDescription,\n  FieldGroup,\n  FieldLabel,\n} from \"@/registry/react-aria-sera/ui/field\"\nimport { Input } from \"@/registry/react-aria-sera/ui/input\"\n\nexport function LoginForm({\n  className,\n  ...props\n}: React.ComponentProps<\"div\">) {\n  return (\n    <div className={cn(\"flex flex-col gap-6\", className)} {...props}>\n      <Card>\n        <CardHeader>\n          <CardTitle>Login to your account</CardTitle>\n          <CardDescription>\n            Enter your email below to login to your account\n          </CardDescription>\n        </CardHeader>\n        <CardContent>\n          <form>\n            <FieldGroup>\n              <Field>\n                <FieldLabel htmlFor=\"email\">Email</FieldLabel>\n                <Input\n                  id=\"email\"\n                  type=\"email\"\n                  placeholder=\"m@example.com\"\n                  required\n                />\n              </Field>\n              <Field>\n                <div className=\"flex items-center\">\n                  <FieldLabel htmlFor=\"password\">Password</FieldLabel>\n                  <a\n                    href=\"#\"\n                    className=\"ml-auto inline-block text-sm underline-offset-4 hover:underline\"\n                  >\n                    Forgot your password?\n                  </a>\n                </div>\n                <Input id=\"password\" type=\"password\" required />\n              </Field>\n              <Field>\n                <Button type=\"submit\">Login</Button>\n                <Button variant=\"outline\" type=\"button\">\n                  Login with Google\n                </Button>\n                <FieldDescription className=\"text-center\">\n                  Don&apos;t have an account? <a href=\"#\">Sign up</a>\n                </FieldDescription>\n              </Field>\n            </FieldGroup>\n          </form>\n        </CardContent>\n      </Card>\n    </div>\n  )\n}\n",
      "type": "registry:component"
    }
  ],
  "categories": [
    "authentication",
    "login"
  ],
  "type": "registry:block"
}