{
  "$schema": "https://ui.shadcn.com/schema/registry-item.json",
  "name": "textarea",
  "files": [
    {
      "path": "registry/radix-mira/ui/textarea.tsx",
      "content": "import * as React from \"react\"\n\nimport { cn } from \"@/registry/radix-mira/lib/utils\"\n\nfunction Textarea({ className, ...props }: React.ComponentProps<\"textarea\">) {\n  return (\n    <textarea\n      data-slot=\"textarea\"\n      className={cn(\n        \"flex field-sizing-content min-h-16 w-full resize-none rounded-md border border-input bg-input/20 px-2 py-2 text-sm transition-colors outline-none placeholder:text-muted-foreground focus-visible:border-ring focus-visible:ring-2 focus-visible:ring-ring/30 disabled:cursor-not-allowed disabled:opacity-50 md:text-xs/relaxed dark:bg-input/30 data-invalid:border-destructive data-invalid:ring-2 data-invalid:ring-destructive/20 dark:data-invalid:border-destructive/50 dark:data-invalid:ring-destructive/40\",\n        className\n      )}\n      {...props}\n    />\n  )\n}\n\nexport { Textarea }\n",
      "type": "registry:ui"
    }
  ],
  "meta": {
    "links": {
      "docs": "https://ui.shadcn.com/docs/components/radix/textarea",
      "examples": "https://raw.githubusercontent.com/shadcn-ui/ui/refs/heads/main/apps/v4/registry/bases/radix/examples/textarea-example.tsx"
    }
  },
  "type": "registry:ui"
}