{
  "$schema": "https://ui.shadcn.com/schema/registry-item.json",
  "name": "resizable",
  "dependencies": [
    "react-resizable-panels"
  ],
  "files": [
    {
      "path": "registry/react-aria-maia/ui/resizable.tsx",
      "content": "\"use client\"\n\nimport * as ResizablePrimitive from \"react-resizable-panels\"\n\nimport { cn } from \"@/registry/react-aria-maia/lib/utils\"\n\nfunction ResizablePanelGroup({\n  className,\n  ...props\n}: ResizablePrimitive.GroupProps) {\n  return (\n    <ResizablePrimitive.Group\n      data-slot=\"resizable-panel-group\"\n      className={cn(\n        \"flex h-full w-full aria-[orientation=vertical]:flex-col\",\n        className\n      )}\n      {...props}\n    />\n  )\n}\n\nfunction ResizablePanel({ ...props }: ResizablePrimitive.PanelProps) {\n  return <ResizablePrimitive.Panel data-slot=\"resizable-panel\" {...props} />\n}\n\nfunction ResizableHandle({\n  withHandle,\n  className,\n  ...props\n}: ResizablePrimitive.SeparatorProps & {\n  withHandle?: boolean\n}) {\n  return (\n    <ResizablePrimitive.Separator\n      data-slot=\"resizable-handle\"\n      className={cn(\n        \"relative flex w-px items-center justify-center bg-border ring-offset-background after:absolute after:inset-y-0 after:left-1/2 after:w-1 after:-translate-x-1/2 focus-visible:ring-1 focus-visible:ring-ring focus-visible:outline-hidden aria-[orientation=horizontal]:h-px aria-[orientation=horizontal]:w-full aria-[orientation=horizontal]:after:left-0 aria-[orientation=horizontal]:after:h-1 aria-[orientation=horizontal]:after:w-full aria-[orientation=horizontal]:after:translate-x-0 aria-[orientation=horizontal]:after:-translate-y-1/2 [&[aria-orientation=horizontal]>div]:rotate-90\",\n        className\n      )}\n      {...props}\n    >\n      {withHandle && (\n        <div className=\"z-10 flex h-6 w-1 shrink-0 rounded-lg bg-border\" />\n      )}\n    </ResizablePrimitive.Separator>\n  )\n}\n\nexport { ResizableHandle, ResizablePanel, ResizablePanelGroup }\n",
      "type": "registry:ui"
    }
  ],
  "type": "registry:ui"
}