{
  "$schema": "https://ui.shadcn.com/schema/registry-item.json",
  "name": "tabs",
  "files": [
    {
      "path": "registry/base-luma/ui/tabs.tsx",
      "content": "\"use client\"\n\nimport { Tabs as TabsPrimitive } from \"@base-ui/react/tabs\"\nimport { cva, type VariantProps } from \"class-variance-authority\"\n\nimport { cn } from \"@/registry/base-luma/lib/utils\"\n\nfunction Tabs({\n  className,\n  orientation = \"horizontal\",\n  ...props\n}: TabsPrimitive.Root.Props) {\n  return (\n    <TabsPrimitive.Root\n      data-slot=\"tabs\"\n      data-orientation={orientation}\n      className={cn(\n        \"group/tabs flex gap-2 data-horizontal:flex-col\",\n        className\n      )}\n      {...props}\n    />\n  )\n}\n\nconst tabsListVariants = cva(\n  \"group/tabs-list inline-flex w-fit items-center justify-center rounded-full p-1 text-muted-foreground group-data-horizontal/tabs:h-9 group-data-vertical/tabs:h-fit group-data-vertical/tabs:flex-col group-data-vertical/tabs:rounded-2xl data-[variant=line]:rounded-none\",\n  {\n    variants: {\n      variant: {\n        default: \"bg-muted\",\n        line: \"gap-1 bg-transparent\",\n      },\n    },\n    defaultVariants: {\n      variant: \"default\",\n    },\n  }\n)\n\nfunction TabsList({\n  className,\n  variant = \"default\",\n  ...props\n}: TabsPrimitive.List.Props & VariantProps<typeof tabsListVariants>) {\n  return (\n    <TabsPrimitive.List\n      data-slot=\"tabs-list\"\n      data-variant={variant}\n      className={cn(tabsListVariants({ variant }), className)}\n      {...props}\n    />\n  )\n}\n\nfunction TabsTrigger({ className, ...props }: TabsPrimitive.Tab.Props) {\n  return (\n    <TabsPrimitive.Tab\n      data-slot=\"tabs-trigger\"\n      className={cn(\n        \"relative inline-flex flex-1 items-center justify-center gap-2 rounded-full border border-transparent! px-3 py-1 text-sm font-medium whitespace-nowrap text-foreground/60 transition-all group-data-vertical/tabs:w-full group-data-vertical/tabs:justify-start group-data-vertical/tabs:rounded-2xl group-data-vertical/tabs:px-3 group-data-vertical/tabs:py-1.5 hover:text-foreground focus-visible:border-ring focus-visible:ring-[3px] focus-visible:ring-ring/50 focus-visible:outline-1 focus-visible:outline-ring disabled:pointer-events-none disabled:opacity-50 has-data-[icon=inline-end]:pr-2 has-data-[icon=inline-start]:pl-2 aria-disabled:pointer-events-none aria-disabled:opacity-50 dark:text-muted-foreground dark:hover:text-foreground [&_svg]:pointer-events-none [&_svg]:shrink-0 [&_svg:not([class*='size-'])]:size-4\",\n        \"group-data-[variant=line]/tabs-list:bg-transparent group-data-[variant=line]/tabs-list:data-active:bg-transparent dark:group-data-[variant=line]/tabs-list:data-active:border-transparent dark:group-data-[variant=line]/tabs-list:data-active:bg-transparent\",\n        \"data-active:bg-background data-active:text-foreground dark:data-active:border-input dark:data-active:bg-input/30 dark:data-active:text-foreground\",\n        \"after:absolute after:bg-foreground after:opacity-0 after:transition-opacity group-data-horizontal/tabs:after:inset-x-0 group-data-horizontal/tabs:after:bottom-[-5px] group-data-horizontal/tabs:after:h-0.5 group-data-vertical/tabs:after:inset-y-0 group-data-vertical/tabs:after:-right-1 group-data-vertical/tabs:after:w-0.5 group-data-[variant=line]/tabs-list:data-active:after:opacity-100\",\n        className\n      )}\n      {...props}\n    />\n  )\n}\n\nfunction TabsContent({ className, ...props }: TabsPrimitive.Panel.Props) {\n  return (\n    <TabsPrimitive.Panel\n      data-slot=\"tabs-content\"\n      className={cn(\"flex-1 text-sm outline-none\", className)}\n      {...props}\n    />\n  )\n}\n\nexport { Tabs, TabsList, TabsTrigger, TabsContent, tabsListVariants }\n",
      "type": "registry:ui"
    }
  ],
  "meta": {
    "links": {
      "docs": "https://ui.shadcn.com/docs/components/base/tabs",
      "examples": "https://ui.shadcn.com/code/apps/v4/registry/bases/base/examples/tabs-example.tsx",
      "api": "https://base-ui.com/react/components/tabs.md"
    }
  },
  "type": "registry:ui"
}