{
  "$schema": "https://ui.shadcn.com/schema/registry-item.json",
  "name": "accordion",
  "files": [
    {
      "path": "registry/radix-force-ui/ui/accordion.tsx",
      "content": "\"use client\"\n\nimport * as React from \"react\"\nimport { Accordion as AccordionPrimitive } from \"radix-ui\"\n\nimport { cn } from \"@/registry/radix-force-ui/lib/utils\"\nimport { IconPlaceholder } from \"@/app/(create)/components/icon-placeholder\"\n\nfunction Accordion({\n  className,\n  ...props\n}: React.ComponentProps<typeof AccordionPrimitive.Root>) {\n  return (\n    <AccordionPrimitive.Root\n      data-slot=\"accordion\"\n      className={cn(\"flex w-full flex-col\", className)}\n      {...props}\n    />\n  )\n}\n\nfunction AccordionItem({\n  className,\n  ...props\n}: React.ComponentProps<typeof AccordionPrimitive.Item>) {\n  return (\n    <AccordionPrimitive.Item\n      data-slot=\"accordion-item\"\n      className={cn(\"not-last:border-b\", className)}\n      {...props}\n    />\n  )\n}\n\nfunction AccordionTrigger({\n  className,\n  children,\n  ...props\n}: React.ComponentProps<typeof AccordionPrimitive.Trigger>) {\n  return (\n    <AccordionPrimitive.Header className=\"flex\">\n      <AccordionPrimitive.Trigger\n        data-slot=\"accordion-trigger\"\n        className={cn(\n          \"group/accordion-trigger relative flex flex-1 items-start justify-between rounded-lg border border-transparent py-2.5 text-left text-sm font-medium transition-all outline-none hover:underline focus-visible:border-ring focus-visible:ring-3 focus-visible:ring-ring/50 focus-visible:after:border-ring disabled:pointer-events-none disabled:opacity-50 **:data-[slot=accordion-trigger-icon]:ml-auto **:data-[slot=accordion-trigger-icon]:size-4 **:data-[slot=accordion-trigger-icon]:text-muted-foreground group-aria-expanded/accordion-trigger:**:data-[slot=accordion-trigger-icon]:text-foreground\",\n          className\n        )}\n        {...props}\n      >\n        {children}\n        <IconPlaceholder\n          lucide=\"ChevronDownIcon\"\n          materialSymbols=\"keyboard_arrow_down\"\n          tabler=\"IconChevronDown\"\n          data-slot=\"accordion-trigger-icon\"\n          hugeicons=\"ArrowDown01Icon\"\n          phosphor=\"CaretDownIcon\"\n          remixicon=\"RiArrowDownSLine\"\n          className=\"pointer-events-none shrink-0 group-aria-expanded/accordion-trigger:hidden\"\n        />\n        <IconPlaceholder\n          lucide=\"ChevronUpIcon\"\n          materialSymbols=\"keyboard_arrow_up\"\n          tabler=\"IconChevronUp\"\n          data-slot=\"accordion-trigger-icon\"\n          hugeicons=\"ArrowUp01Icon\"\n          phosphor=\"CaretUpIcon\"\n          remixicon=\"RiArrowUpSLine\"\n          className=\"pointer-events-none hidden shrink-0 group-aria-expanded/accordion-trigger:inline\"\n        />\n      </AccordionPrimitive.Trigger>\n    </AccordionPrimitive.Header>\n  )\n}\n\nfunction AccordionContent({\n  className,\n  children,\n  ...props\n}: React.ComponentProps<typeof AccordionPrimitive.Content>) {\n  return (\n    <AccordionPrimitive.Content\n      data-slot=\"accordion-content\"\n      className=\"overflow-hidden text-sm motion-reduce:animate-none data-open:animate-accordion-down data-closed:animate-accordion-up\"\n      {...props}\n    >\n      <div\n        className={cn(\n          \"h-(--radix-accordion-content-height) pt-0 pb-2.5 [&_a]:underline [&_a]:underline-offset-3 [&_a]:hover:text-foreground [&_p:not(:last-child)]:mb-4\",\n          className\n        )}\n      >\n        {children}\n      </div>\n    </AccordionPrimitive.Content>\n  )\n}\n\nexport { Accordion, AccordionItem, AccordionTrigger, AccordionContent }\n",
      "type": "registry:ui"
    }
  ],
  "meta": {
    "links": {
      "docs": "https://shadcn-force-ui.vercel.app/docs/components/radix/accordion",
      "examples": "https://raw.githubusercontent.com/lobiklukas/shadcn-ui/refs/heads/main/apps/v4/registry/bases/radix/examples/accordion-example.tsx",
      "api": "https://www.radix-ui.com/primitives/docs/components/accordion.md"
    }
  },
  "type": "registry:ui"
}