{
  "$schema": "https://ui.shadcn.com/schema/registry-item.json",
  "name": "card",
  "files": [
    {
      "path": "registry/radix-rhea/ui/card.tsx",
      "content": "import * as React from \"react\"\n\nimport { cn } from \"@/registry/radix-rhea/lib/utils\"\n\nfunction Card({\n  className,\n  size = \"default\",\n  ...props\n}: React.ComponentProps<\"div\"> & { size?: \"default\" | \"sm\" }) {\n  return (\n    <div\n      data-slot=\"card\"\n      data-size={size}\n      className={cn(\n        \"group/card flex flex-col gap-5 overflow-hidden rounded-4xl bg-card py-5 text-sm text-card-foreground shadow-sm ring-1 ring-foreground/5 has-[>img:first-child]:pt-0 data-[size=sm]:gap-4 data-[size=sm]:py-4 dark:ring-foreground/10 *:[img:first-child]:rounded-t-4xl *:[img:last-child]:rounded-b-4xl\",\n        className\n      )}\n      {...props}\n    />\n  )\n}\n\nfunction CardHeader({ className, ...props }: React.ComponentProps<\"div\">) {\n  return (\n    <div\n      data-slot=\"card-header\"\n      className={cn(\n        \"group/card-header @container/card-header grid auto-rows-min items-start gap-1.5 rounded-t-4xl px-5 group-data-[size=sm]/card:px-4 has-data-[slot=card-action]:grid-cols-[1fr_auto] has-data-[slot=card-description]:grid-rows-[auto_auto] [.border-b]:pb-5 group-data-[size=sm]/card:[.border-b]:pb-4\",\n        className\n      )}\n      {...props}\n    />\n  )\n}\n\nfunction CardTitle({ className, ...props }: React.ComponentProps<\"div\">) {\n  return (\n    <div\n      data-slot=\"card-title\"\n      className={cn(\"cn-font-heading text-base font-medium\", className)}\n      {...props}\n    />\n  )\n}\n\nfunction CardDescription({ className, ...props }: React.ComponentProps<\"div\">) {\n  return (\n    <div\n      data-slot=\"card-description\"\n      className={cn(\"text-sm text-muted-foreground\", className)}\n      {...props}\n    />\n  )\n}\n\nfunction CardAction({ className, ...props }: React.ComponentProps<\"div\">) {\n  return (\n    <div\n      data-slot=\"card-action\"\n      className={cn(\n        \"col-start-2 row-span-2 row-start-1 self-start justify-self-end\",\n        className\n      )}\n      {...props}\n    />\n  )\n}\n\nfunction CardContent({ className, ...props }: React.ComponentProps<\"div\">) {\n  return (\n    <div\n      data-slot=\"card-content\"\n      className={cn(\"px-5 group-data-[size=sm]/card:px-4\", className)}\n      {...props}\n    />\n  )\n}\n\nfunction CardFooter({ className, ...props }: React.ComponentProps<\"div\">) {\n  return (\n    <div\n      data-slot=\"card-footer\"\n      className={cn(\n        \"flex items-center rounded-b-4xl px-5 group-data-[size=sm]/card:px-4 [.border-t]:pt-5 group-data-[size=sm]/card:[.border-t]:pt-4\",\n        className\n      )}\n      {...props}\n    />\n  )\n}\n\nexport {\n  Card,\n  CardHeader,\n  CardFooter,\n  CardTitle,\n  CardAction,\n  CardDescription,\n  CardContent,\n}\n",
      "type": "registry:ui"
    }
  ],
  "meta": {
    "links": {
      "docs": "https://ui.shadcn.com/docs/components/radix/card",
      "examples": "https://ui.shadcn.com/code/apps/v4/registry/bases/radix/examples/card-example.tsx"
    }
  },
  "type": "registry:ui"
}