{
  "$schema": "https://ui.shadcn.com/schema/registry-item.json",
  "name": "dialog",
  "registryDependencies": [
    "button"
  ],
  "files": [
    {
      "path": "registry/aria-luma/ui/dialog.tsx",
      "content": "\"use client\"\n\nimport * as React from \"react\"\nimport {\n  Dialog as DialogPrimitive,\n  DialogTrigger as DialogTriggerPrimitive,\n  Heading,\n  ModalOverlay as ModalOverlayPrimitive,\n  Modal as ModalPrimitive,\n  type DialogProps as DialogPrimitiveProps,\n  type DialogTriggerProps as DialogTriggerPrimitiveProps,\n  type ModalOverlayProps as ModalOverlayPrimitiveProps,\n  type ModalRenderProps,\n} from \"react-aria-components\"\n\nimport { cn } from \"@/registry/aria-luma/lib/utils\"\nimport { Button } from \"@/registry/aria-luma/ui/button\"\nimport { IconPlaceholder } from \"@/app/(create)/components/icon-placeholder\"\n\nfunction DialogTrigger({ ...props }: DialogTriggerPrimitiveProps) {\n  return <DialogTriggerPrimitive {...props} />\n}\n\nfunction DialogClose({\n  className,\n  variant = \"outline\",\n  size = \"default\",\n  ...props\n}: React.ComponentProps<typeof Button>) {\n  return (\n    <Button\n      slot=\"close\"\n      data-slot=\"dialog-close\"\n      variant={variant}\n      size={size}\n      className={cn(className)}\n      {...props}\n    />\n  )\n}\n\nfunction DialogOverlay({\n  className,\n  children,\n  ...props\n}: Omit<ModalOverlayPrimitiveProps, \"className\" | \"children\"> & {\n  className?: string\n  children: React.ReactNode\n}) {\n  return (\n    <ModalOverlayPrimitive\n      data-slot=\"dialog-overlay\"\n      className={cn(\n        \"fixed inset-0 isolate z-50 bg-black/30 duration-100 supports-backdrop-filter:backdrop-blur-sm data-open:animate-in data-open:fade-in-0 data-closed:animate-out data-closed:fade-out-0\",\n        className\n      )}\n      // Keep existing data-open/data-closed selectors working with RAC state.\n      render={(renderProps, state: ModalRenderProps) => (\n        <div\n          {...renderProps}\n          data-open={!state.isExiting}\n          data-closed={state.isExiting}\n        />\n      )}\n      {...props}\n    >\n      {children}\n    </ModalOverlayPrimitive>\n  )\n}\n\nfunction Dialog({\n  className,\n  children,\n  showCloseButton = true,\n  isDismissable = true,\n  ...props\n}: Omit<ModalOverlayPrimitiveProps, \"className\" | \"children\"> &\n  Pick<React.ComponentProps<typeof ModalPrimitive>, \"isDismissable\"> & {\n    className?: string\n    children: React.ReactNode\n    showCloseButton?: boolean\n  }) {\n  return (\n    <DialogOverlay isDismissable={isDismissable} {...props}>\n      <ModalPrimitive\n        data-slot=\"dialog-content\"\n        className={cn(\n          \"fixed top-1/2 left-1/2 z-50 grid w-full max-w-[calc(100%-2rem)] -translate-x-1/2 -translate-y-1/2 gap-6 rounded-4xl bg-popover p-6 text-sm text-popover-foreground shadow-xl ring-1 ring-foreground/5 duration-100 outline-none sm:max-w-md dark:ring-foreground/10 data-open:animate-in data-open:fade-in-0 data-open:zoom-in-95 data-closed:animate-out data-closed:fade-out-0 data-closed:zoom-out-95\",\n          className\n        )}\n        // Keep existing data-open/data-closed selectors working with RAC state.\n        render={(renderProps, state: ModalRenderProps) => (\n          <div\n            {...renderProps}\n            data-open={!state.isExiting}\n            data-closed={state.isExiting}\n          />\n        )}\n      >\n        <DialogPrimitive\n          data-slot=\"dialog\"\n          className=\"[display:inherit] [gap:inherit] outline-none\"\n        >\n          {children}\n          {showCloseButton && (\n            <DialogClose\n              variant=\"ghost\"\n              className=\"absolute top-4 right-4 bg-secondary\"\n              size=\"icon-sm\"\n            >\n              <IconPlaceholder\n                lucide=\"XIcon\"\n                tabler=\"IconX\"\n                hugeicons=\"Cancel01Icon\"\n                phosphor=\"XIcon\"\n                remixicon=\"RiCloseLine\"\n              />\n              <span className=\"sr-only\">Close</span>\n            </DialogClose>\n          )}\n        </DialogPrimitive>\n      </ModalPrimitive>\n    </DialogOverlay>\n  )\n}\n\nfunction DialogHeader({ className, ...props }: React.ComponentProps<\"div\">) {\n  return (\n    <div\n      data-slot=\"dialog-header\"\n      className={cn(\"flex flex-col gap-1.5\", className)}\n      {...props}\n    />\n  )\n}\n\nfunction DialogFooter({\n  className,\n  showCloseButton = false,\n  children,\n  ...props\n}: React.ComponentProps<\"div\"> & {\n  showCloseButton?: boolean\n}) {\n  return (\n    <div\n      data-slot=\"dialog-footer\"\n      className={cn(\n        \"flex flex-col-reverse gap-2 sm:flex-row sm:justify-end\",\n        className\n      )}\n      {...props}\n    >\n      {children}\n      {showCloseButton && <DialogClose variant=\"outline\">Close</DialogClose>}\n    </div>\n  )\n}\n\nfunction DialogTitle({\n  className,\n  ...props\n}: Omit<React.ComponentProps<typeof Heading>, \"slot\">) {\n  return (\n    <Heading\n      slot=\"title\"\n      data-slot=\"dialog-title\"\n      className={cn(\n        \"cn-font-heading text-base leading-none font-medium\",\n        className\n      )}\n      {...props}\n    />\n  )\n}\n\nfunction DialogDescription({\n  className,\n  ...props\n}: Omit<React.ComponentProps<\"div\">, \"slot\">) {\n  return (\n    <div\n      data-slot=\"dialog-description\"\n      className={cn(\n        \"text-sm text-muted-foreground *:[a]:underline *:[a]:underline-offset-3 *:[a]:hover:text-foreground\",\n        className\n      )}\n      {...props}\n    />\n  )\n}\n\nexport type { DialogPrimitiveProps, DialogTriggerPrimitiveProps }\n\nexport {\n  Dialog,\n  DialogClose,\n  DialogDescription,\n  DialogFooter,\n  DialogHeader,\n  DialogOverlay,\n  DialogTitle,\n  DialogTrigger,\n}\n",
      "type": "registry:ui"
    }
  ],
  "meta": {
    "links": {
      "docs": "https://ui.shadcn.com/docs/components/aria/dialog",
      "examples": "https://ui.shadcn.com/code/apps/v4/registry/bases/aria/examples/dialog-example.tsx",
      "api": "https://react-aria.adobe.com/Modal#api"
    }
  },
  "type": "registry:ui"
}