{
  "$schema": "https://ui.shadcn.com/schema/registry-item.json",
  "name": "breadcrumb",
  "files": [
    {
      "path": "registry/aria-sera/ui/breadcrumb.tsx",
      "content": "\"use client\"\n\nimport * as React from \"react\"\nimport {\n  Breadcrumb as BreadcrumbPrimitive,\n  Breadcrumbs as BreadcrumbsPrimitive,\n  composeRenderProps,\n  Link as LinkPrimitive,\n  type BreadcrumbProps,\n  type BreadcrumbsProps,\n  type LinkProps,\n} from \"react-aria-components\"\n\nimport { cn } from \"@/registry/aria-sera/lib/utils\"\nimport { IconPlaceholder } from \"@/app/(create)/components/icon-placeholder\"\n\nfunction Breadcrumb({ className, ...props }: React.ComponentProps<\"nav\">) {\n  return (\n    <nav\n      aria-label=\"breadcrumb\"\n      data-slot=\"breadcrumb\"\n      className={cn(className)}\n      {...props}\n    />\n  )\n}\n\nfunction BreadcrumbList<T extends object>({\n  className,\n  ...props\n}: BreadcrumbsProps<T>) {\n  return (\n    <BreadcrumbsPrimitive\n      data-slot=\"breadcrumb-list\"\n      className={cn(\n        \"flex flex-wrap items-center gap-1.5 text-xs tracking-wide wrap-break-word text-muted-foreground uppercase sm:gap-2.5\",\n        className\n      )}\n      {...props}\n    />\n  )\n}\n\nfunction BreadcrumbItem({\n  className,\n  children,\n  separatorClassName,\n  ...props\n}: BreadcrumbProps & { separatorClassName?: string }) {\n  return (\n    <BreadcrumbPrimitive\n      data-slot=\"breadcrumb-item\"\n      className={cn(\"inline-flex items-center gap-1.5\", className)}\n      {...props}\n    >\n      {composeRenderProps(children, (children, { isCurrent }) => (\n        <>\n          {children}\n          {!isCurrent && (\n            <span\n              data-slot=\"breadcrumb-separator\"\n              role=\"presentation\"\n              aria-hidden=\"true\"\n              className={cn(\"[&>svg]:size-3.5\", separatorClassName)}\n            >\n              <IconPlaceholder\n                lucide=\"ChevronRightIcon\"\n                tabler=\"IconChevronRight\"\n                hugeicons=\"ArrowRight01Icon\"\n                phosphor=\"CaretRightIcon\"\n                remixicon=\"RiArrowRightSLine\"\n                className=\"cn-rtl-flip\"\n              />\n            </span>\n          )}\n        </>\n      ))}\n    </BreadcrumbPrimitive>\n  )\n}\n\nfunction BreadcrumbLink({ className, render, ...props }: LinkProps) {\n  return (\n    <LinkPrimitive\n      data-slot=\"breadcrumb-link\"\n      className={cn(\"transition-colors hover:text-foreground\", className)}\n      render={render}\n      {...props}\n    />\n  )\n}\n\nfunction BreadcrumbPage({ className, ...props }: React.ComponentProps<\"span\">) {\n  return (\n    <span\n      data-slot=\"breadcrumb-page\"\n      role=\"link\"\n      aria-disabled=\"true\"\n      aria-current=\"page\"\n      className={cn(\"font-normal text-foreground\", className)}\n      {...props}\n    />\n  )\n}\n\nfunction BreadcrumbEllipsis({\n  className,\n  ...props\n}: React.ComponentProps<\"span\">) {\n  return (\n    <span\n      data-slot=\"breadcrumb-ellipsis\"\n      role=\"presentation\"\n      aria-hidden=\"true\"\n      className={cn(\n        \"flex size-5 items-center justify-center [&>svg]:size-4\",\n        className\n      )}\n      {...props}\n    >\n      <IconPlaceholder\n        lucide=\"MoreHorizontalIcon\"\n        tabler=\"IconDots\"\n        hugeicons=\"MoreHorizontalCircle01Icon\"\n        phosphor=\"DotsThreeIcon\"\n        remixicon=\"RiMoreLine\"\n      />\n      <span className=\"sr-only\">More</span>\n    </span>\n  )\n}\n\nexport {\n  Breadcrumb,\n  BreadcrumbList,\n  BreadcrumbItem,\n  BreadcrumbLink,\n  BreadcrumbPage,\n  BreadcrumbEllipsis,\n}\n",
      "type": "registry:ui"
    }
  ],
  "meta": {
    "links": {
      "docs": "https://ui.shadcn.com/docs/components/aria/breadcrumb",
      "examples": "https://ui.shadcn.com/code/apps/v4/registry/bases/aria/examples/breadcrumb-example.tsx",
      "api": "https://react-aria.adobe.com/Breadcrumbs#api"
    }
  },
  "type": "registry:ui"
}