{
  "$schema": "https://ui.shadcn.com/schema/registry-item.json",
  "name": "dialog",
  "registryDependencies": [
    "button"
  ],
  "files": [
    {
      "path": "registry/ark-maia/ui/dialog.tsx",
      "content": "\"use client\"\n\nimport * as React from \"react\"\nimport {\n  Dialog as DialogPrimitive,\n  useDialog,\n  useDialogContext,\n  type DialogOpenChangeDetails,\n} from \"@ark-ui/react/dialog\"\nimport { ark } from \"@ark-ui/react/factory\"\nimport { Portal } from \"@ark-ui/react/portal\"\n\nimport { cn } from \"@/registry/ark-maia/lib/utils\"\nimport { Button } from \"@/registry/ark-maia/ui/button\"\nimport { IconPlaceholder } from \"@/app/(create)/components/icon-placeholder\"\n\nfunction Dialog({\n  ...props\n}: React.ComponentProps<typeof DialogPrimitive.Root>) {\n  return <DialogPrimitive.Root data-slot=\"dialog\" {...props} />\n}\n\nfunction DialogTrigger({\n  ...props\n}: React.ComponentProps<typeof DialogPrimitive.Trigger>) {\n  return <DialogPrimitive.Trigger data-slot=\"dialog-trigger\" {...props} />\n}\n\nfunction DialogClose({\n  ...props\n}: React.ComponentProps<typeof DialogPrimitive.CloseTrigger>) {\n  return <DialogPrimitive.CloseTrigger data-slot=\"dialog-close\" {...props} />\n}\n\nfunction DialogOverlay({\n  className,\n  ...props\n}: React.ComponentProps<typeof DialogPrimitive.Backdrop>) {\n  return (\n    <DialogPrimitive.Backdrop\n      data-slot=\"dialog-overlay\"\n      className={cn(\n        \"fixed inset-0 isolate z-50 bg-black/80 duration-100 supports-backdrop-filter:backdrop-blur-xs data-open:animate-in data-open:fade-in-0 data-closed:animate-out data-closed:fade-out-0\",\n        className\n      )}\n      {...props}\n    />\n  )\n}\n\nfunction DialogContent({\n  className,\n  children,\n  showCloseButton = true,\n  ...props\n}: React.ComponentProps<typeof DialogPrimitive.Content> & {\n  showCloseButton?: boolean\n}) {\n  return (\n    <Portal>\n      <DialogOverlay />\n      <DialogPrimitive.Positioner className=\"fixed inset-0 z-50 flex items-center justify-center\">\n        <DialogPrimitive.Content\n          data-slot=\"dialog-content\"\n          className={cn(\n            \"z-50 grid w-full max-w-[calc(100%-2rem)] gap-6 rounded-4xl bg-background p-6 text-sm ring-1 ring-foreground/5 duration-100 outline-none sm:max-w-md data-open:animate-in data-open:fade-in-0 data-open:zoom-in-95 data-closed:animate-out data-closed:fade-out-0 data-closed:zoom-out-95\",\n            className\n          )}\n          {...props}\n        >\n          {children}\n          {showCloseButton && (\n            <DialogPrimitive.CloseTrigger data-slot=\"dialog-close\" asChild>\n              <Button\n                variant=\"ghost\"\n                className=\"absolute top-4 right-4\"\n                size=\"icon-sm\"\n              >\n                <IconPlaceholder\n                  lucide=\"XIcon\"\n                  tabler=\"IconX\"\n                  hugeicons=\"Cancel01Icon\"\n                  phosphor=\"XIcon\"\n                  remixicon=\"RiCloseLine\"\n                />\n                <span className=\"sr-only\">Close</span>\n              </Button>\n            </DialogPrimitive.CloseTrigger>\n          )}\n        </DialogPrimitive.Content>\n      </DialogPrimitive.Positioner>\n    </Portal>\n  )\n}\n\nfunction DialogHeader({\n  className,\n  ...props\n}: React.ComponentProps<typeof ark.div>) {\n  return (\n    <ark.div\n      data-slot=\"dialog-header\"\n      className={cn(\"flex flex-col gap-2\", className)}\n      {...props}\n    />\n  )\n}\n\nfunction DialogFooter({\n  className,\n  showCloseButton = false,\n  children,\n  ...props\n}: React.ComponentProps<typeof ark.div> & {\n  showCloseButton?: boolean\n}) {\n  return (\n    <ark.div\n      data-slot=\"dialog-footer\"\n      className={cn(\n        \"flex flex-col-reverse gap-2 sm:flex-row sm:justify-end\",\n        className\n      )}\n      {...props}\n    >\n      {children}\n      {showCloseButton && (\n        <DialogPrimitive.CloseTrigger asChild>\n          <Button variant=\"outline\">Close</Button>\n        </DialogPrimitive.CloseTrigger>\n      )}\n    </ark.div>\n  )\n}\n\nfunction DialogTitle({\n  className,\n  ...props\n}: React.ComponentProps<typeof DialogPrimitive.Title>) {\n  return (\n    <DialogPrimitive.Title\n      data-slot=\"dialog-title\"\n      className={cn(\"text-base leading-none font-medium\", className)}\n      {...props}\n    />\n  )\n}\n\nfunction DialogDescription({\n  className,\n  ...props\n}: React.ComponentProps<typeof DialogPrimitive.Description>) {\n  return (\n    <DialogPrimitive.Description\n      data-slot=\"dialog-description\"\n      className={cn(\n        \"text-sm text-muted-foreground *:[a]:underline *:[a]:underline-offset-3 *:[a]:hover:text-foreground\",\n        className\n      )}\n      {...props}\n    />\n  )\n}\n\nconst DialogContext = DialogPrimitive.Context\nconst DialogRootProvider = DialogPrimitive.RootProvider\n\nexport {\n  Dialog,\n  DialogClose,\n  DialogContent,\n  DialogContext,\n  DialogDescription,\n  DialogFooter,\n  DialogHeader,\n  DialogOverlay,\n  DialogRootProvider,\n  DialogTitle,\n  DialogTrigger,\n  useDialog,\n  useDialogContext,\n  type DialogOpenChangeDetails,\n}\n",
      "type": "registry:ui"
    }
  ],
  "type": "registry:ui"
}