{
  "$schema": "https://ui.shadcn.com/schema/registry-item.json",
  "name": "input-group",
  "registryDependencies": [
    "button",
    "input",
    "textarea"
  ],
  "files": [
    {
      "path": "registry/aria-rhea/ui/input-group.tsx",
      "content": "\"use client\"\n\nimport * as React from \"react\"\nimport { cva, type VariantProps } from \"class-variance-authority\"\nimport { Group, type GroupProps } from \"react-aria-components\"\n\nimport { cn } from \"@/registry/aria-rhea/lib/utils\"\nimport { Button } from \"@/registry/aria-rhea/ui/button\"\nimport { Input } from \"@/registry/aria-rhea/ui/input\"\nimport { Textarea } from \"@/registry/aria-rhea/ui/textarea\"\n\nfunction InputGroup({ className, ...props }: GroupProps) {\n  return (\n    <Group\n      data-slot=\"input-group\"\n      className={cn(\n        \"group/input-group relative flex h-8 w-full min-w-0 items-center rounded-2xl border border-transparent bg-input/50 transition-[color,box-shadow] duration-200 outline-none in-data-[slot=combobox-content]:focus-within:border-inherit in-data-[slot=combobox-content]:focus-within:ring-0 has-[[data-slot=input-group-control]:focus-visible]:border-ring has-[[data-slot=input-group-control]:focus-visible]:ring-3 has-[[data-slot=input-group-control]:focus-visible]:ring-ring/30 has-[[data-slot][aria-invalid=true]]:border-destructive has-[[data-slot][aria-invalid=true]]:ring-3 has-[[data-slot][aria-invalid=true]]:ring-destructive/20 has-[>[data-align=block-end]]:h-auto has-[>[data-align=block-end]]:flex-col has-[>[data-align=block-start]]:h-auto has-[>[data-align=block-start]]:flex-col has-[>textarea]:h-auto dark:has-[[data-slot][aria-invalid=true]]:ring-destructive/40 has-[>[data-align=block-end]]:[&>input]:pt-3 has-[>[data-align=block-start]]:[&>input]:pb-3 has-[>[data-align=inline-end]]:[&>input]:pr-1.5 has-[>[data-align=inline-start]]:[&>input]:pl-1.5\",\n        className\n      )}\n      {...props}\n    />\n  )\n}\n\nconst inputGroupAddonVariants = cva(\n  \"flex h-auto cursor-text items-center justify-center gap-2 py-1.5 text-sm font-medium text-muted-foreground select-none group-data-[disabled=true]/input-group:opacity-50 **:data-[slot=kbd]:rounded-2xl **:data-[slot=kbd]:bg-muted-foreground/10 **:data-[slot=kbd]:px-1.5 [&>svg:not([class*='size-'])]:size-4\",\n  {\n    variants: {\n      align: {\n        \"inline-start\":\n          \"order-first pl-2 has-[>button]:ml-[-0.3rem] has-[>kbd]:ml-[-0.15rem]\",\n        \"inline-end\":\n          \"order-last pr-2 has-[>button]:mr-[-0.3rem] has-[>kbd]:mr-[-0.15rem]\",\n        \"block-start\":\n          \"order-first w-full justify-start px-2.5 pt-2 group-has-[>input]/input-group:pt-2 [.border-b]:pb-2\",\n        \"block-end\":\n          \"order-last w-full justify-start px-2.5 pb-2 group-has-[>input]/input-group:pb-2 [.border-t]:pt-2\",\n      },\n    },\n    defaultVariants: {\n      align: \"inline-start\",\n    },\n  }\n)\n\nfunction InputGroupAddon({\n  className,\n  align = \"inline-start\",\n  ...props\n}: React.ComponentProps<\"div\"> & VariantProps<typeof inputGroupAddonVariants>) {\n  return (\n    <div\n      role=\"group\"\n      data-slot=\"input-group-addon\"\n      data-align={align}\n      className={cn(inputGroupAddonVariants({ align }), className)}\n      onClick={(e) => {\n        if ((e.target as HTMLElement).closest(\"button\")) {\n          return\n        }\n        e.currentTarget.parentElement?.querySelector(\"input\")?.focus()\n      }}\n      {...props}\n    />\n  )\n}\n\nconst inputGroupButtonVariants = cva(\n  \"flex items-center gap-2 rounded-2xl text-sm shadow-none\",\n  {\n    variants: {\n      size: {\n        xs: \"h-6 gap-1 rounded-xl px-1.5 [&>svg:not([class*='size-'])]:size-3.5\",\n        sm: \"\",\n        \"icon-xs\": \"size-6 rounded-xl p-0 has-[>svg]:p-0\",\n        \"icon-sm\": \"size-8 p-0 has-[>svg]:p-0\",\n      },\n    },\n    defaultVariants: {\n      size: \"xs\",\n    },\n  }\n)\n\nfunction InputGroupButton({\n  className,\n  type = \"button\",\n  variant = \"ghost\",\n  size = \"xs\",\n  ...props\n}: Omit<React.ComponentProps<typeof Button>, \"size\" | \"type\"> &\n  VariantProps<typeof inputGroupButtonVariants> & {\n    type?: \"button\" | \"submit\" | \"reset\"\n  }) {\n  return (\n    <Button\n      type={type}\n      data-size={size}\n      variant={variant}\n      className={cn(inputGroupButtonVariants({ size }), className)}\n      {...props}\n    />\n  )\n}\n\nfunction InputGroupText({ className, ...props }: React.ComponentProps<\"span\">) {\n  return (\n    <span\n      className={cn(\n        \"flex items-center gap-2 text-sm text-muted-foreground [&_svg]:pointer-events-none [&_svg:not([class*='size-'])]:size-4\",\n        className\n      )}\n      {...props}\n    />\n  )\n}\n\nfunction InputGroupInput({\n  className,\n  ...props\n}: React.ComponentProps<\"input\">) {\n  return (\n    <Input\n      data-slot=\"input-group-control\"\n      className={cn(\n        \"flex-1 rounded-none border-0 bg-transparent shadow-none ring-0 focus-visible:ring-0 dark:bg-transparent data-invalid:ring-0\",\n        className\n      )}\n      {...props}\n    />\n  )\n}\n\nfunction InputGroupTextarea({\n  className,\n  ...props\n}: React.ComponentProps<\"textarea\">) {\n  return (\n    <Textarea\n      data-slot=\"input-group-control\"\n      className={cn(\n        \"flex-1 resize-none rounded-none border-0 bg-transparent py-2 shadow-none ring-0 focus-visible:ring-0 dark:bg-transparent data-invalid:ring-0\",\n        className\n      )}\n      {...props}\n    />\n  )\n}\n\nexport {\n  InputGroup,\n  InputGroupAddon,\n  InputGroupButton,\n  InputGroupText,\n  InputGroupInput,\n  InputGroupTextarea,\n}\n",
      "type": "registry:ui"
    }
  ],
  "meta": {
    "links": {
      "docs": "https://ui.shadcn.com/docs/components/aria/input-group",
      "examples": "https://ui.shadcn.com/code/apps/v4/registry/bases/aria/examples/input-group-example.tsx",
      "api": "https://react-aria.adobe.com/Group#api"
    }
  },
  "type": "registry:ui"
}