{
  "name": "chart-pie-label-list",
  "type": "registry:block",
  "registryDependencies": [
    "card",
    "chart"
  ],
  "files": [
    {
      "path": "block/chart-pie-label-list.tsx",
      "content": "\"use client\"\r\n\r\nimport { TrendingUp } from \"lucide-react\"\r\nimport { LabelList, Pie, PieChart } from \"recharts\"\r\n\r\nimport {\r\n  Card,\r\n  CardContent,\r\n  CardDescription,\r\n  CardFooter,\r\n  CardHeader,\r\n  CardTitle,\r\n} from \"@/registry/default/ui/card\"\r\nimport {\r\n  ChartConfig,\r\n  ChartContainer,\r\n  ChartTooltip,\r\n  ChartTooltipContent,\r\n} from \"@/registry/default/ui/chart\"\nconst chartData = [\r\n  { browser: \"chrome\", visitors: 275, fill: \"var(--color-chrome)\" },\r\n  { browser: \"safari\", visitors: 200, fill: \"var(--color-safari)\" },\r\n  { browser: \"firefox\", visitors: 187, fill: \"var(--color-firefox)\" },\r\n  { browser: \"edge\", visitors: 173, fill: \"var(--color-edge)\" },\r\n  { browser: \"other\", visitors: 90, fill: \"var(--color-other)\" },\r\n]\r\n\r\nconst chartConfig = {\r\n  visitors: {\r\n    label: \"Visitors\",\r\n  },\r\n  chrome: {\r\n    label: \"Chrome\",\r\n    color: \"hsl(var(--chart-1))\",\r\n  },\r\n  safari: {\r\n    label: \"Safari\",\r\n    color: \"hsl(var(--chart-2))\",\r\n  },\r\n  firefox: {\r\n    label: \"Firefox\",\r\n    color: \"hsl(var(--chart-3))\",\r\n  },\r\n  edge: {\r\n    label: \"Edge\",\r\n    color: \"hsl(var(--chart-4))\",\r\n  },\r\n  other: {\r\n    label: \"Other\",\r\n    color: \"hsl(var(--chart-5))\",\r\n  },\r\n} satisfies ChartConfig\r\n\r\nexport default function Component() {\r\n  return (\r\n    <Card className=\"flex flex-col\">\r\n      <CardHeader className=\"items-center pb-0\">\r\n        <CardTitle>Pie Chart - Label List</CardTitle>\r\n        <CardDescription>January - June 2024</CardDescription>\r\n      </CardHeader>\r\n      <CardContent className=\"flex-1 pb-0\">\r\n        <ChartContainer\r\n          config={chartConfig}\r\n          className=\"mx-auto aspect-square max-h-[250px]\"\r\n        >\r\n          <PieChart>\r\n            <ChartTooltip\r\n              content={<ChartTooltipContent nameKey=\"visitors\" hideLabel />}\r\n            />\r\n            <Pie data={chartData} dataKey=\"visitors\">\r\n              <LabelList\r\n                dataKey=\"browser\"\r\n                className=\"fill-background\"\r\n                stroke=\"none\"\r\n                fontSize={12}\r\n                formatter={(value: keyof typeof chartConfig) =>\r\n                  chartConfig[value]?.label\r\n                }\r\n              />\r\n            </Pie>\r\n          </PieChart>\r\n        </ChartContainer>\r\n      </CardContent>\r\n      <CardFooter className=\"flex-col gap-2 text-sm\">\r\n        <div className=\"flex items-center gap-2 font-medium leading-none\">\r\n          Trending up by 5.2% this month <TrendingUp className=\"h-4 w-4\" />\r\n        </div>\r\n        <div className=\"leading-none text-muted-foreground\">\r\n          Showing total visitors for the last 6 months\r\n        </div>\r\n      </CardFooter>\r\n    </Card>\r\n  )\r\n}\r\n",
      "type": "registry:block",
      "target": ""
    }
  ]
}