{
  "$schema": "https://ui.shadcn.com/schema/registry-item.json",
  "name": "badge",
  "files": [
    {
      "path": "registry/radix-maia/ui/badge.tsx",
      "content": "import * as React from \"react\"\nimport { cva, type VariantProps } from \"class-variance-authority\"\nimport { Slot } from \"radix-ui\"\n\nimport { cn } from \"@/registry/radix-maia/lib/utils\"\n\nconst badgeVariants = cva(\n  \"h-5 gap-1 rounded-4xl border border-transparent px-2 py-0.5 text-xs font-medium transition-all has-data-[icon=inline-end]:pr-1.5 has-data-[icon=inline-start]:pl-1.5 [&>svg]:size-3! inline-flex items-center justify-center w-fit whitespace-nowrap shrink-0 [&>svg]:pointer-events-none focus-visible:border-ring focus-visible:ring-ring/50 focus-visible:ring-[3px] aria-invalid:ring-destructive/20 dark:aria-invalid:ring-destructive/40 aria-invalid:border-destructive overflow-hidden group/badge\",\n  {\n    variants: {\n      variant: {\n        default: \"bg-primary text-primary-foreground [a]:hover:bg-primary/80\",\n        secondary:\n          \"bg-secondary text-secondary-foreground [a]:hover:bg-secondary/80\",\n        destructive:\n          \"bg-destructive/10 [a]:hover:bg-destructive/20 focus-visible:ring-destructive/20 dark:focus-visible:ring-destructive/40 text-destructive dark:bg-destructive/20\",\n        outline:\n          \"border-border text-foreground [a]:hover:bg-muted [a]:hover:text-muted-foreground bg-input/30\",\n        ghost:\n          \"hover:bg-muted hover:text-muted-foreground dark:hover:bg-muted/50\",\n        link: \"text-primary underline-offset-4 hover:underline\",\n      },\n    },\n    defaultVariants: {\n      variant: \"default\",\n    },\n  }\n)\n\nfunction Badge({\n  className,\n  variant = \"default\",\n  asChild = false,\n  ...props\n}: React.ComponentProps<\"span\"> &\n  VariantProps<typeof badgeVariants> & { asChild?: boolean }) {\n  const Comp = asChild ? Slot.Root : \"span\"\n\n  return (\n    <Comp\n      data-slot=\"badge\"\n      data-variant={variant}\n      className={cn(badgeVariants({ variant }), className)}\n      {...props}\n    />\n  )\n}\n\nexport { Badge, badgeVariants }\n",
      "type": "registry:ui"
    }
  ],
  "meta": {
    "links": {
      "docs": "https://ui.shadcn.com/docs/components/radix/badge",
      "examples": "https://raw.githubusercontent.com/shadcn-ui/ui/refs/heads/main/apps/v4/registry/bases/radix/examples/badge-example.tsx"
    }
  },
  "type": "registry:ui"
}