{
  "$schema": "https://ui.shadcn.com/schema/registry-item.json",
  "name": "login-03",
  "title": "Login 03",
  "description": "A login page with a muted background color.",
  "registryDependencies": [
    "button",
    "card",
    "input",
    "label",
    "field"
  ],
  "files": [
    {
      "path": "registry/ark-nova/blocks/login-03/page.tsx",
      "content": "\"use client\"\n\nimport { LoginForm } from \"@/registry/ark-nova/blocks/login-03/components/login-form\"\nimport { IconPlaceholder } from \"@/app/(create)/components/icon-placeholder\"\n\nexport default function LoginPage() {\n  return (\n    <div className=\"flex min-h-svh flex-col items-center justify-center gap-6 bg-muted p-6 md:p-10\">\n      <div className=\"flex w-full max-w-sm flex-col gap-6\">\n        <a href=\"#\" className=\"flex items-center gap-2 self-center font-medium\">\n          <div className=\"flex size-6 items-center justify-center rounded-md bg-primary text-primary-foreground\">\n            <IconPlaceholder\n              lucide=\"GalleryVerticalEndIcon\"\n              tabler=\"IconLayoutRows\"\n              hugeicons=\"LayoutBottomIcon\"\n              phosphor=\"RowsIcon\"\n              remixicon=\"RiGalleryLine\"\n              className=\"size-4\"\n            />\n          </div>\n          Acme Inc.\n        </a>\n        <LoginForm />\n      </div>\n    </div>\n  )\n}\n",
      "type": "registry:page",
      "target": "app/login/page.tsx"
    },
    {
      "path": "registry/ark-nova/blocks/login-03/components/login-form.tsx",
      "content": "import { cn } from \"@/registry/ark-nova/lib/utils\"\nimport { Button } from \"@/registry/ark-nova/ui/button\"\nimport {\n  Card,\n  CardContent,\n  CardDescription,\n  CardHeader,\n  CardTitle,\n} from \"@/registry/ark-nova/ui/card\"\nimport {\n  Field,\n  FieldDescription,\n  FieldGroup,\n  FieldLabel,\n  FieldSeparator,\n} from \"@/registry/ark-nova/ui/field\"\nimport { Input } from \"@/registry/ark-nova/ui/input\"\n\nexport function LoginForm({\n  className,\n  ...props\n}: React.ComponentProps<\"div\">) {\n  return (\n    <div className={cn(\"flex flex-col gap-6\", className)} {...props}>\n      <Card>\n        <CardHeader className=\"text-center\">\n          <CardTitle className=\"text-xl\">Welcome back</CardTitle>\n          <CardDescription>\n            Login with your Apple or Google account\n          </CardDescription>\n        </CardHeader>\n        <CardContent>\n          <form>\n            <FieldGroup>\n              <Field>\n                <Button variant=\"outline\" type=\"button\">\n                  <svg xmlns=\"http://www.w3.org/2000/svg\" viewBox=\"0 0 24 24\">\n                    <path\n                      d=\"M12.152 6.896c-.948 0-2.415-1.078-3.96-1.04-2.04.027-3.91 1.183-4.961 3.014-2.117 3.675-.546 9.103 1.519 12.09 1.013 1.454 2.208 3.09 3.792 3.039 1.52-.065 2.09-.987 3.935-.987 1.831 0 2.35.987 3.96.948 1.637-.026 2.676-1.48 3.676-2.948 1.156-1.688 1.636-3.325 1.662-3.415-.039-.013-3.182-1.221-3.22-4.857-.026-3.04 2.48-4.494 2.597-4.559-1.429-2.09-3.623-2.324-4.39-2.376-2-.156-3.675 1.09-4.61 1.09zM15.53 3.83c.843-1.012 1.4-2.427 1.245-3.83-1.207.052-2.662.805-3.532 1.818-.78.896-1.454 2.338-1.273 3.714 1.338.104 2.715-.688 3.559-1.701\"\n                      fill=\"currentColor\"\n                    />\n                  </svg>\n                  Login with Apple\n                </Button>\n                <Button variant=\"outline\" type=\"button\">\n                  <svg xmlns=\"http://www.w3.org/2000/svg\" viewBox=\"0 0 24 24\">\n                    <path\n                      d=\"M12.48 10.92v3.28h7.84c-.24 1.84-.853 3.187-1.787 4.133-1.147 1.147-2.933 2.4-6.053 2.4-4.827 0-8.6-3.893-8.6-8.72s3.773-8.72 8.6-8.72c2.6 0 4.507 1.027 5.907 2.347l2.307-2.307C18.747 1.44 16.133 0 12.48 0 5.867 0 .307 5.387.307 12s5.56 12 12.173 12c3.573 0 6.267-1.173 8.373-3.36 2.16-2.16 2.84-5.213 2.84-7.667 0-.76-.053-1.467-.173-2.053H12.48z\"\n                      fill=\"currentColor\"\n                    />\n                  </svg>\n                  Login with Google\n                </Button>\n              </Field>\n              <FieldSeparator className=\"*:data-[slot=field-separator-content]:bg-card\">\n                Or continue with\n              </FieldSeparator>\n              <Field>\n                <FieldLabel htmlFor=\"email\">Email</FieldLabel>\n                <Input\n                  id=\"email\"\n                  type=\"email\"\n                  placeholder=\"m@example.com\"\n                  required\n                />\n              </Field>\n              <Field>\n                <div className=\"flex items-center\">\n                  <FieldLabel htmlFor=\"password\">Password</FieldLabel>\n                  <a\n                    href=\"#\"\n                    className=\"ml-auto text-sm underline-offset-4 hover:underline\"\n                  >\n                    Forgot your password?\n                  </a>\n                </div>\n                <Input id=\"password\" type=\"password\" required />\n              </Field>\n              <Field>\n                <Button type=\"submit\">Login</Button>\n                <FieldDescription className=\"text-center\">\n                  Don&apos;t have an account? <a href=\"#\">Sign up</a>\n                </FieldDescription>\n              </Field>\n            </FieldGroup>\n          </form>\n        </CardContent>\n      </Card>\n      <FieldDescription className=\"px-6 text-center\">\n        By clicking continue, you agree to our <a href=\"#\">Terms of Service</a>{\" \"}\n        and <a href=\"#\">Privacy Policy</a>.\n      </FieldDescription>\n    </div>\n  )\n}\n",
      "type": "registry:component"
    }
  ],
  "categories": [
    "authentication",
    "login"
  ],
  "type": "registry:block"
}